{
  "explainability_schema_version": "1.0",
  "explainability_version": "p0.4-v1",
  "availability_status": "generated",
  "model_id": "gradient_boosting",
  "model_version": "p0.4-v1",
  "estimator_family": "GradientBoostingRegressor",
  "estimator_library": "scikit-learn",
  "estimator_library_version": "1.9.0",
  "estimator_role": "chronological_holdout_validation_model",
  "model_parameters": {
    "n_estimators": 200,
    "learning_rate": 0.05,
    "max_depth": 4,
    "min_samples_leaf": 3,
    "subsample": 0.8,
    "random_state": 42,
    "loss": "squared_error"
  },
  "model_parameters_sha256": "4741d1f17b3bf98988b886dcb6157a9382b569e3264e1004d2f3eb474bd34963",
  "target": "target_cases_next_2w",
  "forecast_horizon": {
    "value": 14,
    "unit": "days"
  },
  "feature_names": [
    "rainfall_lag_2w",
    "rainfall_lag_4w",
    "temp_lag_2w",
    "temp_lag_4w",
    "humidity_lag_2w",
    "humidity_lag_4w",
    "cases_lag_1w",
    "cases_lag_2w",
    "cases_lag_4w",
    "cases_rolling_3w",
    "cases_rolling_4w",
    "cases_rolling_8w",
    "growth_rate_1w",
    "growth_rate_2w",
    "epi_week_sin",
    "epi_week_cos",
    "monsoon_flag",
    "post_monsoon_flag"
  ],
  "feature_formula_ids": [
    "FEATURE.CLIMATE_LAGS",
    "FEATURE.CASE_LAGS",
    "FEATURE.CASE_ROLLING",
    "FEATURE.GROWTH_RATIOS",
    "FEATURE.SEASONAL_CYCLIC",
    "FEATURE.SEASON_FLAGS"
  ],
  "feature_order_sha256": "aeccbe517da452e1132f08c02599418523fb003280b11ff9cda66cfb3aa55a85",
  "training_period": {
    "start": {
      "epi_year": 2021,
      "epi_week": 6
    },
    "end": {
      "epi_year": 2023,
      "epi_week": 39
    }
  },
  "validation_period": {
    "start": {
      "epi_year": 2023,
      "epi_week": 40
    },
    "end": {
      "epi_year": 2024,
      "epi_week": 22
    }
  },
  "validation_rows": 35,
  "validation_matrix_sha256": "d749da62bf6edfc81bab4bcb3731c86f649ae72b2d15628b4f72dc8ae66e329b",
  "evaluation_split": "final_chronological_20_percent",
  "importance_methods": [
    "holdout_permutation_importance",
    "native_tree_importance"
  ],
  "impurity_importance": [
    0.15108473047554907,
    0.460138697609018,
    0.03509391444321787,
    0.019511831717507384,
    0.06482074257754038,
    0.015678485214471412,
    0.06478785239086636,
    0.01516894044802201,
    0.008185743389467563,
    0.022871817397893075,
    0.013141766440737999,
    0.018684078997656194,
    0.01133883335649232,
    0.015180454983820335,
    0.07318506187517176,
    0.010436073313872083,
    0.0004547423211337853,
    0.00023623304756234686
  ],
  "permutation_importance": [
    1.6566608821865185,
    2.0603922936834147,
    -0.5324328606125368,
    0.2542515944989708,
    -0.1491057110306384,
    0.41768358973669917,
    1.660614786969561,
    0.10375324793188909,
    1.0354117437720878,
    -1.1175136450338417,
    1.731943383707486,
    1.0735227652219796,
    -0.4604237469408483,
    0.2532125232576622,
    4.7642960744870875,
    0.30574804982468307,
    0.034335018228026294,
    0.12313968552023216
  ],
  "permutation_std": [
    1.4592745330629069,
    1.4742959595926004,
    0.21756998974153366,
    0.1701369074104203,
    0.9215586743932216,
    0.5840680842231396,
    1.1808340288019483,
    0.382861806454503,
    0.29133428970254255,
    0.5053884930042094,
    0.4467192429210086,
    0.7545979435138087,
    0.5620082797643188,
    0.6468615303647142,
    1.8123136996059932,
    0.29991518982884424,
    0.05693176876068951,
    0.06651037527970534
  ],
  "permutation_repeats": 20,
  "permutation_scoring": "neg_mean_absolute_error",
  "permutation_random_state": 42,
  "permutation_max_samples": 1.0,
  "feature_ranking": [
    {
      "feature_name": "rainfall_lag_2w",
      "formula_id": "FEATURE.CLIMATE_LAGS",
      "feature_index": 0,
      "impurity_importance": 0.15108473047554907,
      "permutation_mean": 1.6566608821865185,
      "permutation_standard_deviation": 1.4592745330629069,
      "rank_by_impurity": 2,
      "rank_by_permutation": 5,
      "rank_disagreement": false,
      "permutation_is_negative": false,
      "permutation_is_zero": false
    },
    {
      "feature_name": "rainfall_lag_4w",
      "formula_id": "FEATURE.CLIMATE_LAGS",
      "feature_index": 1,
      "impurity_importance": 0.460138697609018,
      "permutation_mean": 2.0603922936834147,
      "permutation_standard_deviation": 1.4742959595926004,
      "rank_by_impurity": 1,
      "rank_by_permutation": 2,
      "rank_disagreement": false,
      "permutation_is_negative": false,
      "permutation_is_zero": false
    },
    {
      "feature_name": "temp_lag_2w",
      "formula_id": "FEATURE.CLIMATE_LAGS",
      "feature_index": 2,
      "impurity_importance": 0.03509391444321787,
      "permutation_mean": -0.5324328606125368,
      "permutation_standard_deviation": 0.21756998974153366,
      "rank_by_impurity": 6,
      "rank_by_permutation": 17,
      "rank_disagreement": true,
      "permutation_is_negative": true,
      "permutation_is_zero": false
    },
    {
      "feature_name": "temp_lag_4w",
      "formula_id": "FEATURE.CLIMATE_LAGS",
      "feature_index": 3,
      "impurity_importance": 0.019511831717507384,
      "permutation_mean": 0.2542515944989708,
      "permutation_standard_deviation": 0.1701369074104203,
      "rank_by_impurity": 8,
      "rank_by_permutation": 10,
      "rank_disagreement": false,
      "permutation_is_negative": false,
      "permutation_is_zero": false
    },
    {
      "feature_name": "humidity_lag_2w",
      "formula_id": "FEATURE.CLIMATE_LAGS",
      "feature_index": 4,
      "impurity_importance": 0.06482074257754038,
      "permutation_mean": -0.1491057110306384,
      "permutation_standard_deviation": 0.9215586743932216,
      "rank_by_impurity": 4,
      "rank_by_permutation": 15,
      "rank_disagreement": true,
      "permutation_is_negative": true,
      "permutation_is_zero": false
    },
    {
      "feature_name": "humidity_lag_4w",
      "formula_id": "FEATURE.CLIMATE_LAGS",
      "feature_index": 5,
      "impurity_importance": 0.015678485214471412,
      "permutation_mean": 0.41768358973669917,
      "permutation_standard_deviation": 0.5840680842231396,
      "rank_by_impurity": 10,
      "rank_by_permutation": 8,
      "rank_disagreement": false,
      "permutation_is_negative": false,
      "permutation_is_zero": false
    },
    {
      "feature_name": "cases_lag_1w",
      "formula_id": "FEATURE.CASE_LAGS",
      "feature_index": 6,
      "impurity_importance": 0.06478785239086636,
      "permutation_mean": 1.660614786969561,
      "permutation_standard_deviation": 1.1808340288019483,
      "rank_by_impurity": 5,
      "rank_by_permutation": 4,
      "rank_disagreement": false,
      "permutation_is_negative": false,
      "permutation_is_zero": false
    },
    {
      "feature_name": "cases_lag_2w",
      "formula_id": "FEATURE.CASE_LAGS",
      "feature_index": 7,
      "impurity_importance": 0.01516894044802201,
      "permutation_mean": 0.10375324793188909,
      "permutation_standard_deviation": 0.382861806454503,
      "rank_by_impurity": 12,
      "rank_by_permutation": 13,
      "rank_disagreement": false,
      "permutation_is_negative": false,
      "permutation_is_zero": false
    },
    {
      "feature_name": "cases_lag_4w",
      "formula_id": "FEATURE.CASE_LAGS",
      "feature_index": 8,
      "impurity_importance": 0.008185743389467563,
      "permutation_mean": 1.0354117437720878,
      "permutation_standard_deviation": 0.29133428970254255,
      "rank_by_impurity": 16,
      "rank_by_permutation": 7,
      "rank_disagreement": true,
      "permutation_is_negative": false,
      "permutation_is_zero": false
    },
    {
      "feature_name": "cases_rolling_3w",
      "formula_id": "FEATURE.CASE_ROLLING",
      "feature_index": 9,
      "impurity_importance": 0.022871817397893075,
      "permutation_mean": -1.1175136450338417,
      "permutation_standard_deviation": 0.5053884930042094,
      "rank_by_impurity": 7,
      "rank_by_permutation": 18,
      "rank_disagreement": true,
      "permutation_is_negative": true,
      "permutation_is_zero": false
    },
    {
      "feature_name": "cases_rolling_4w",
      "formula_id": "FEATURE.CASE_ROLLING",
      "feature_index": 10,
      "impurity_importance": 0.013141766440737999,
      "permutation_mean": 1.731943383707486,
      "permutation_standard_deviation": 0.4467192429210086,
      "rank_by_impurity": 13,
      "rank_by_permutation": 3,
      "rank_disagreement": true,
      "permutation_is_negative": false,
      "permutation_is_zero": false
    },
    {
      "feature_name": "cases_rolling_8w",
      "formula_id": "FEATURE.CASE_ROLLING",
      "feature_index": 11,
      "impurity_importance": 0.018684078997656194,
      "permutation_mean": 1.0735227652219796,
      "permutation_standard_deviation": 0.7545979435138087,
      "rank_by_impurity": 9,
      "rank_by_permutation": 6,
      "rank_disagreement": false,
      "permutation_is_negative": false,
      "permutation_is_zero": false
    },
    {
      "feature_name": "growth_rate_1w",
      "formula_id": "FEATURE.GROWTH_RATIOS",
      "feature_index": 12,
      "impurity_importance": 0.01133883335649232,
      "permutation_mean": -0.4604237469408483,
      "permutation_standard_deviation": 0.5620082797643188,
      "rank_by_impurity": 14,
      "rank_by_permutation": 16,
      "rank_disagreement": false,
      "permutation_is_negative": true,
      "permutation_is_zero": false
    },
    {
      "feature_name": "growth_rate_2w",
      "formula_id": "FEATURE.GROWTH_RATIOS",
      "feature_index": 13,
      "impurity_importance": 0.015180454983820335,
      "permutation_mean": 0.2532125232576622,
      "permutation_standard_deviation": 0.6468615303647142,
      "rank_by_impurity": 11,
      "rank_by_permutation": 11,
      "rank_disagreement": false,
      "permutation_is_negative": false,
      "permutation_is_zero": false
    },
    {